feedback,Category
Apple works with apple. Had other wireless mice but always a problem. The wireless apple mouse no problem.,Positive
"It's just like I purchased the mouse directly from Apple. It connected easily and works with my MacBook and iPad without issue. The battery life is AMAZING! I've had it for nearly a month and I only had to charge it once. Also, the feel in my hand is amazing. I also love the fact that it doesn't have the wheel but responds to fingers scrolling like on the screen. Totally worth the money I spent on it. I would buy another if I needed it.",Positive
"Love these shoes and it was first time buying Nikes from amazon and not the Nike website due to UPS delivery from Nike unable to get shoes to me, but these are great, highly recommend.",Positive
"You can never have too many Legos! Perfect assortment of colors, shapes and sizes. Easy to use!! Very durable! Fun for all ages!",Positive
I used this product as a shoe and since nike stopped doing shocks I have held back on buying any nicer Nikes but these are nice I dig them and they like me too .. totally comfortable I think I could wear these out,Positive
"So far, it has been interesting. A lot of it I already know as I've worked in marketing for such a long time, but I signed up to this course as I've always had others set up adwords, I've just set the strategy, so I'm gaining some useful insights",Positive
"So, i have been listening and enjoying sleep stories for years but there is one that is completely and totally possesses me for a long time.. It's not just the voice of narrator and it he certainly not his looks lol.. but the story itself. Today, i am in Paris and it's raining.. and i never thought i would enjoy as much as i do today, the day as it goes now.. Thank you for emotions it evoke and for the memories associated with your story.",Positive
This is great for kids and I always buy from Amazon .Amazon always have better price then the other store,Positive
Horrible Horrible!!!! why outsource your customer service to India????? When you say rude as hell and unprofessional all tied up in a pile of crap. If I didn't have my flight credits lord knows I wouldn't fly with united....,Negative
I am using for my two children from their childhood.. Not scented and good quality,Positive
"It's Apple!! I use the “find me” for my keys, my husbands keys, and our dogs collar.(Just incase she got out unexpected). I had one of the air tags due after 4 years, so easy to replace in Amazon.",Positive
"This is in reference to flight UA721 flying from Newark to Orlando. Avoid this airline if you can. They will delay your flight multiple times, and then they will cancel your flight (due to ""severe weather conditions,"" which from what I can see in Newark and what my husband can see in Orlando is nonsense). They have zero (I mean zero) consideration for their passangers. I actually feel embarrassed for them. They offer no food to compensate for the wait, and on top of that they have a bunch of unfriendly, unempathetic employees (the perfect employee for this pathetic excuse of an airline)--cogs that couldn't rise to the challenge to go beyond the level of a cog--working behind their counters. Their cobwebbed brains impede them from taking into consideration people's exhaustion or chronic illnesses that they might have. It's the kind of situation that makes you think that humanity is a disaster without any hope of redemption. If you have the money to choose another airline, do it.",Negative
The provides the best BASIC knowledge to PPC and a little bit about the display network. I have liked it if there were some advanced material as the course went on.,Positive with Suggestion
"Everything in life is a subscription now these days. We all chipped in to lessen the cost of Netflix and enjoy it, now we have to ether pay way more, or go solo with it. With everything else people have to pay for, this was one that was enjoyable, because people helped and made it the best and cheapest streaming service. Is it a lot of money? No. Does it add up when you have no choice but to subscribe to everything else in life? Absolutely.",Negative
There was a time when y'all claimed password sharing didn't effect your business and that you actually saw increase in customers. To see netflix (and other streaming services) begin a witch hunt for password sharers looks like customers are just gonna start moving back to cable tv.,Negative
"These very first time I used it. My luggage was lost. The agent told me my suitcase was in Madrid. I showed her on my phone where it was in Dallas. A short six days later, I was reunited with my suitcase.",Positive
I went from not knowing anything about ad words to running several campaigns. Still learning as I go but this course was a fantastic start. Well worth your time!,Positive
I am a health care worker that lives on a pager. My sleep is disturbed regularly by getting woken up in the middle of the night. I used to lye in bed unable to fall back to sleep. Knowing I would be exhausted when I had to go to work the next day. Calm changed that! Listening to a sleep story helps me to fall back to sleep quickly. It's comforting to know I have this app to help me on those nights.,Positive
"When I worked in IT, I set up a MacBook with one of these and silently ridiculed the user for needing such a fancy/schmancy mouse: a ten-dollar mouse with a forty-dollar logo. That was until I used it. So now I have a fancy/schmancy mouse that's worth every penny, except for the location of the charging port, which make the unit unusable when charging.",Positive with Suggestion
"The documentaries are skewed by who makes them. No real trusted impartial journalism anymore. Giving legitimacy to corrupt voices is wrong in any context without proper disclosure of the corruption (both ethical and moral are denied in some documentaries, yet their voices are heard as truth). New content is crap. The scripted “reality tv” market is overdone and gross. The price keeps going up while the content goes down. This is the streaming service I could do without and contemplating the relevance currently.",Negative with Suggestion
Translate review to English,Negative with Suggestion
It's a great course that covers most of Adwords' aspects. Good for newbies also. The teacher is really helpful :),Positive
Translate review to English,Negative with Suggestion
This was a great course to learn about ad words especially if you don't have any knowledge of what ad words are.,Positive
It says my TV isn't a part of my network and won't work. It works on my phone. Sometimes updates make things worse and take away functionality. This is an example of that. Thanks for ruining my evening yet again! What a joke!,Negative
"I enjoyed the lessons here in this course, very impactful they were. However using a phone it's not clear enough but above all I loved it.",Positive with Suggestion
My son has a blast playing with his legos makes me think of when I used to play with mine as a kid,Positive
"Good guide for learning by doing. Google adwords is still fairly intimidating software, by the nature of not explaining everything from scratch, but I feel comfortable with the basics.",Positive
"First off, I would like to say everyone is different and how this app effects them may vary. In my experience though it has helped me so much with my anxiety. It's helped me sleep better and just feel much better about myself. I was struggling the last couple months with anxiety and it was causing me panic attacks and I started to get full blown insomnia. For two weeks I had totaled at 8 and a half hours of sleep the whole week (not one night). My cousin gifted me a yearly subscription for this app and genuinely have never been more grateful. If you have the resources to spend on this app and you really need it, I would definitely recommend giving it a chance. If you don't have the money I'm not sure what the free version is like but it may be good. And a word of advice, also use resources outside the app for help as well! You got this and stay strong!",Positive
"I'm uninstalling Spotify, I can't able to play song which I wanted, and can't even change the track What is happening??",Negative
"My kids love them, I love that it gives me some kid free time time! Haha They keep my five year old twins busy for long stretches of time. They are durable, bright colors, packaged nicely with the colors separated. The container they come in isn't full all the way so you can add more Legos later on and have a place to keep them all together. I thought the price was fair also.",Positive
This app is now becoming Worst day by day,Negative
"I saw a preview for BURNT, and I had hesitated to watch this movie for years. But the preview was intriguing. So I headed to Netflix to watch. While the movie was amazing (in theaters it would have been brilliant!), there was one (or more) crucial scenes cut out! How frustrating to watch an anticipated movie only to have it incomplete! Whatever your reasons for sliming down films, stop. Please.",Negative with Suggestion
"We've flown on our journey this summer many times with United and we were dissatisfied every time. First, they cancelled TWO Non-Stop flights of 10 hours just 2 weeks befor our trip and put us on flights with stops, that are both 5 hours. This means the plane is smaller AND less comfortable seats - so no normal first class seats, that you would expect on a 10 hour journey. On top: We could not pick our seats in first class. There were seats assigned to us and so we are now all over the plane and can not sit together. From old planes, to extremly rude and unhelpful staff - there was everything. BUT the highlight is the lounge situation. We've booked first class - in every normal airline this guarantees a spot in the lounge. But not with United. Because we're flying “First INLAND” we are not allowed in the lounge. Only “First INTERNATIONAL” is allowed there. And Hawaii to New York is still inland. Thats a joke, right? We would have needed to buy a “One Day Pass” for 60 dollars per person. Such a bad customer service is unheard of. Would never fly with them again. Really really bad. And so unhelpful.",Negative
"Great and straight to the point ,easy to follow along and the instructor encourages questions. The quality of the sound and sometimes when you complete a section it doesn't show up so when you complete the course you don't get your completion certificate . But that's just nit picking the course is grate and that's the most important bit. I would take another course from this instructor. Alan Kelly",Positive with Suggestion
Wat kind of update is come .. it is like compulsory Spotify premium,Negative
"As a parent who appreciates the value of open-ended play and creativity in education, the LEGO Classic Large Creative Brick Box 10698 has truly exceeded my expectations. This building toy set is not only an excellent choice for back-to-school fun, but it's also a powerful tool that fosters imagination, problem-solving, and fine motor skills in children.Pros:Abundance of Pieces: This set is a treasure trove of LEGO bricks in various shapes, sizes, and colors. With over 790 pieces, the creative possibilities are virtually limitless.Open-Ended Play: The LEGO Classic Large Creative Brick Box encourages kids to explore their imagination and build whatever they can dream up. There are no strict instructions, allowing children to create their own unique designs and stories.STEM Learning: Through building and playing, kids naturally develop spatial awareness, problem-solving skills, and fine motor control. This set seamlessly integrates learning into playtime.Versatility: The included pieces can be used to build structures, vehicles, animals, and more. The diverse selection of bricks ensures that kids can bring a wide range of ideas to life.Parent-Child Bonding: Building with LEGO is an activity that can be enjoyed together as a family. It provides quality bonding time and a chance for parents to engage with their children's creative endeavors.",Positive
Unbelievably poor. From paying for seat selection that I was then denied for half the flights to rude staff who were completely indifferent to our situation when there were delays in passport control and we missed our connecting flights. Would never recommend nor use again if at all possible.,Negative
"they're nike and if you want the torch 4, there are not a lot of options for where to find them these days.  fit me exactly as expected.",Positive
"Perfect for keeping track of your valuable items, such as a wallet or suitcase. Easy to connect to phone and track. Very durable and long range!",Positive
Spotify think he is only one music app for Indians that's why he change his T&C for free user's.......Buddy I am going to uninstall you now Bye Bye.,Negative
"Comfort:""The Nike Max Torch 4s are incredibly comfortable. From the moment I put them on, they felt great.""""The cushioning is excellent, providing a smooth and comfortable ride.""Fit:""The fit is perfect. They feel true to size and provide a secure, locked-down feel.""""They have a roomy toe box, and the heel cup holds my heel in place very nicely.""Performance:""These shoes are fantastic for my runs. They're responsive and provide great energy return.""""I feel light and fast when I run in these. They're perfect for my daily mileage.""Durability:""They seem very well made. I've put a lot of miles on them and they are holding up very well.""Style:""I love the look of these shoes. They're stylish and modern.""Overall:""Overall, I'm extremely happy with the Nike Max Torch 4s. They're a fantastic running shoe that I would highly recommend.""",Positive
Content and videos are kind of outdated. To have an general idea about the topic it's ok although a bit long for that.,Negative
I bought these for our grandsons to make Lego tables for them. They were the perfect size. The boys have so much fun building with them. They like the sets that are in there with instructions to build many things! Great toy for young minds!,Positive
I love my Apple Air Tag…I have mine on my keys… so I can always know where my keys are..I just bought my husband one too and he loves his too. And we also know where each others keys are at…,Positive
I think the course is comprehensive and the instructor gives good examples that are practical. I would definitely recommend this course to anyone starting out in online marketing.,Positive
"Dog got out (again) and when I tried to find her, the dang phone needed updating and it took well over 10 mins to get everything operational again. So, be sure your phone is UTD to expect to be able to use it quickly.",Negative
He like this.,Positive
"We use these for various reason, I have one on my key ring.  However, when I cannot find them, it is really difficult to hear the find me sound.  I wish it was much louder.  Even one room over it is almost impossible to hear. Other than that they are great.",Positive with Suggestion
I love them  I have it on my keys so I don't lose them & if I do it tells me where they are,Positive
"I have been using Aveeno since my kiddo was born. Few months ago, I bought mustela one time for my kiddo and he got rashes, itchiness all the time from that product. I switched it back to Aveeno wash and after few washes with this shampoo and soap and aveeno oat bath, his skin is great again! There is no smell, nothing bad in this product. I will use their product always! It doesn't dry skin.",Positive
"My life has been a real struggle for me for the past 2 years. The past 8 months have been horrible. Had it not been for this site I'm not sure I would be here. Thank you for all the wonderful work that you do.
You truly are saving lives. Between Calm and therapy I can stay focused and know that there really is more out there!

Thank You Truly you will never know what you have done!",Positive
"I bought this because I edit a lot of pictures mostly using a laptop, it's more comfortable using a mouse. I'm surprised with long the battery lasts. Initially it wasn't accepting gestures but after a few adjustments in the settings it works perfectly",Positive
"I cannot be constructive about United Airlines, they are an absolute and utter debacle, a disgrace to the Airline Industry, How on earth they can justify promoting their service as quality is beyond me. Completely dismissed my genuine and evidential complaint.I would rather row a boat over the Atlantic then use this Airline again. A very poor excuse for a transportation provider.",Negative
This course really helped simplify the AdWords framework and campaign creation process for me. I think I got a lot out of it considering the super cheap price tag. The only critiques I have are that at times it's repetitive and moves very quickly. Constantly had to pause to take notes. Great resource for fellow AdWords beginners though!,Positive with Suggestion
10/10 recommend.,Positive
Found it to be easy to follow. Would have liked quizzes throughout to ensure I'm absorbing information and understanding it properly.,Positive with Suggestion
"Style, quality, and still available after my first purchase of the same shoe in 2020!!!😉",Positive
I bought this for my cat's collar to keep track of him if he got out of the house.  It was always accurate showing where he was and I felt very secure knowing it functions well.  Then I borrowed it for my trip to Cancun.  When I got back and I wanted to put it in the collar again.  It was super easy to check the app on my phone to find it.  I give it great props for connectivity because it showed me that my cat was on a beach in Cancun!  Apple is always on the mark - this product has a great design and result.,Positive
Absolutely horrible airline. They don't enforce the rule to put personal bags under the seat and carryons on the oberhead compartiment wich results in not having enough space for the people who were charged extra to keep their carry-on. Entitled moronpassengers don't give a crap and shove their small bags in the overhead and need to be educated by the staff. I suggested it to a stewardess and she had the rudest reaction. Terrible airline. Even low cost ryanair is better,Negative with Suggestion
Good basic overview of the topic. There's a lot here so you might have to review sections a few times and try out the steps/techniques covered on your own before the info really sinks in.,Positive
We loooove Aveeno our children have sensitive skin and it's the best. We appreciate how you all provide the big bottle at a cheap price compared to others. Thank you. We only purchase from Amazon,Positive
"I got my self sucked in on buying a tumbler, even though I have other brands. No regret It's cute and steady. I will be using it on my trips to Pilates class.",Positive
"I'm thankful for the Calm App.  It has been added to my toolbox, over the last couple of years, to help keep me mentally healthy and sound.  It's helped with anxiety, depression, sleep deprivation and a whole lot more.  

Arthur",Positive
"Never before and never again!!Never ….and I mean never….in booking literally hundreds of flights for dozens of people over 15 years have I ever been denied a standard carry on! Couldn't get a boarding pass until I paid $35 each and checked the carry on bags! The best any United rep had to say is I should have read the fine print. No waiver. No recourse. Pay or miss your flight. I'm a very even keeled guy, and respectful of service personnel….,but I've not been that upset in a looong time.Insult to injury, they asked multiple time for volunteers to check bags free at the gate 😡Definitely get the top-down-corporate-vibe from employees they could care less about your business….there's another sucker in line right behind you. So, enjoy your $140 GOTCHA fee (family of 4) because I will NEVER fly United again.",Negative
Spotify: Music's best streaming companion,Positive
"I was looking for something deeper knowledge about AdWords but I find out this course is perfect for Beginners. So if you have not used AdWords before, this is gold mine for you!",Positive
"They ""stole"" my hard earned miles. I made a reservation for my wife and son to join me on my trip to orlando. To buy 27000 miles they were asking $945! So I figure let me use my miles that I have which were 27111. The 2 tickets were $878.40 including taxes. So I figure these 2 tickets will be for free...Wrong! They only gave me $277.40 for my 27074 miles from my account. So you see the miles and the BS they sell you to use their credit card and get miles does not worth the same. Is just a scam as all of the mile programs from all airlines. Is better to get a credit card that gives you cash back instead of using this scams from the airlines. You have been warned!",Negative
"Aveeno Baby Daily Moisture Gentle Bath Wash & Shampoo with Natural Oat Extract has been a trusted part of our bath routine for the past six years. I've used this product since my firstborn was an infant, and I continue to use it with no complaints.This gentle formula is perfect for both hair and skin, providing a soothing, moisturizing cleanse without any harshness. The natural oat extract works wonderfully to nourish and protect sensitive skin, making it an ideal choice for babies and young children. I love how it leaves their hair soft and their skin smooth, all without irritation.In summary, Aveeno Baby Daily Moisture Gentle Bath Wash & Shampoo is a wonderful product that has stood the test of time in our family. Look at the length and fullness of my daughter's hair. I highly recommend it for parents looking for a gentle, effective, and reliable option for their little ones' bath time.",Positive
"Wrong definition view-through conversions, sometimes feels like first version of presentation with videos being cut only like 5 seconds after finishing talking, stutters, that sort of stuff. Overall a fine introduction though.",Negative
"Outdated, but the Google Ads terminologies and concepts are explained sufficiently as an introductory lesson for me",Positive with Suggestion
"First class was a fraud. Dirty plane that was delayed by over 6 hours( not their fault; bad weather) . Waited for over 1.5 hours on the plane in bitterly cold weather (-18 degrees)with no blankets, warm drinks or information.Plane was stack on the tarmac for apparent 'repairs'.Asked for a blanket because the open door was letting cold air into the plane and was told they had no blanket or pillow ( in first class) because it was an 'internal ' flight! Asked for a coffe and was told to wait until we were airborne ( after 6 hours' delay)! No snacks or drinks when held on plane with no idea when we would be taking off. What a FRAUD United first class  is! Third world airlines would do a far much better job than this! Emirates or Qatar would clean the floor with United! United is a fraudulent joke. Avoid avoid avoid united",Negative
"After an 7+ hour layover all we've been offered is a $15 food voucher. I spent well over $100 on airport food and water while waiting. I kinda ask the addendant if they could comp water or Powerade and she told me to call customer service she was ""too busy"". I was in shock. Instead of giving realistic delay times so we could leave the airport, or book other flights... United slowly increased the delay hour by hour due to maintenance. I finally get on the plane to Maui for our 7+ hour flight and there are no screens nor free wifi. I paid extra for economy plus seating. Which has proven to be absolutely pointless unless you enjoy paying $$$ just to get off the plane faster.  Has United turned into frontier?",Negative with Suggestion
Very comfortable and durable. Stylish too.,Positive
The information presented in this course is slightly outdated. There are quite a number of changes not reflected in the course.,Negative
Excellent introductory course for Google Adwords. The course content and the professor were very clear and easy to follow. I highly recommend it!,Positive
Mouse for MacBook Air,Positive with Suggestion
"…specifically I am thinking about wishing I could block a certain speaker's meditations etc from showing up in my feed. I found her voice to be very grating, and it is not conducive to relaxation to have to keep scrolling bc I can't quickly find an appropriate meditation without her leading it.",Negative with Suggestion
"I love Netflix but some things could be added like of you don't want your child seeing a show, or movie you could band it. Also a comment section would be amazing you could tell people your opinion or the best parts. Netflix could also add themes I know the colors are black and red but it would be more fun if you could choose you own colors but overall this is a really good app would recommend!",Positive with Suggestion
"This Google Adwords for Beginners course changed my life. Must take this course, If you are new in the digital marketing world or if you want to improve your PPC skills. This course helped me quite a lot to pass my Google AdWords exam. Every single lecture in this course gives you so much great insightful. The best part is, the instructor (Corey) shows you how to build and run a complete Campaign step-by-step in plain English and is always ready to help. I would like to thank Corey to introduced such a great course and I am glad that I attended the course that helped me to got the job. Must recommended course !",Positive
I love the style of the shoe.  A bit pricey from what i notmally pay. They fit great. The weight is good. Appears to be very durable.,Positive with Suggestion
"I had calm for 2 or 3 years. It's has help me in alot situations. It helps me in different problems, I have . My husband is diagnosed with cancer with calm and dr , I tend to get some help is hard to take Thank Calm.",Positive
"Finally, my skin can feel good with this!",Positive
