feedback,Category
"I don t find it very useful. It seems disconnected, the examples are poor. It doesn t even go through the basics of opening an adwords account and explaining how it has changed.",Negative
"I have been using the Calm app for several years now. Calm provides so many wonderful options for slowing down and great bedtime stories that never fail to put me to sleep. I really appreciate Calm and all of the exceptionally talented people
who participate in our well-being.",Positive
Very comfortable shoe. Appears to be very well-made. Depending on how active a person is depends on how long a shoe lasts with wear and tear. Because of the fit and comfort I'm reading this five stars. We'll just have to see how long they last.,Positive
This is one of the best BT mice on the market.I use this when traveling.  I normally use a track pad when in my office.,Positive
The number of times this app peer pressures you to share stresses me out. I cant indulge in a single mindful moment or in a deep thought without getting right hooked in the face with a request to share.,Negative
"Apple AirTag: A Must-Have for Anyone Who Moves SmartIf you grew up in the hood, you know losing something can be a real problem. Whether you're grinding your way out or already up, the Apple AirTag is a game-changer for keeping track of your valuables.Why It's Worth It:✔ No More Lost Keys or Wallets – Just track it in the Find My app.✔ Protects Your Expensive Gear – Throw it in a bag, luggage, or even your car.✔ Real-Time Tracking – Apple's network helps you find lost or stolen items fast.✔ Long Battery Life – Lasts a year, no charging needed.✔ Small & Durable – Waterproof and easy to hide anywhere.For under $30, the peace of mind is priceless. If you want to move smart, stay ahead, and protect what's yours, this is a no-brainer.",Positive
Everyone's been saying the same thing. We've been using Spotify for years and suddenly we require a premium version for using all basic things. To say that I'm disappointed is an understatement.,Negative
"When you decide you will not renew… the only choice the App gives you, is to renew… all my  other subscriptions allow a choice (thus I'm at the right place for the transaction) … to me that is a major scam…",Negative with Suggestion
I brought 3 month premium 1 months back but now I am Unable to log in due to some app glitch.generally such problems should be solve in 1 to 2 days but this Spotify team is not even looking in this matter. Spotify should be Thankful to Google Play store because it doesn't have negative rating otherwise Spotify could have negative rating,Negative
"I previously had zero experience with AdWords and bought this course out of curiosity. Upon completion of this course, I now understand how AdWords works and why it is such a powerful tool. While a lot of practical applications were not directly relevant me it was well organized in an easily digestible format for pure learning purposes.",Positive
I bought these for my son and he loves them.,Positive
I started using the calm app when I was struggling and things were falling apart. Now I start my day off by meditating with the calm app. I listen to Tamar's daily calm and it helps me to focus on what I want to concentrate for self improvement. Calm has helped me to make self care a priority which has improved my relationships with my family and friend. I live more in the moment that helps me to respond with kindness and compassion instead of react with anger and hurt. I now enjoy my own company and am learning to treat myself like I would treat my friends. Calm app has gently encouraged me to reflect on myself and the positive changes just followed. I look forward each morning to start my day listening to Tamara and then now also squeeze in Daily Jay and session with Jeff.,Positive
This is what you get when you board a UAL flight; a disgusting table tray uncleaned for who knows how many flights.,Negative
Surprisingly comprehensive and detailed overview of basic and advanced Google Adwords capabilities from an online course.,Positive
"I hate Netflix now, they keep removing actual good movies and shows I wanted to show my friend The Breakfast Club and Netflix removed it. There aren't really any good shows or movies I do still watch some good ones (I recommend Kim's Convenience) but I really wish they kept old movies and shows on there, Netflix is garbage now.",Negative with Suggestion
requires continued use to get used to cordless use,Negative
"First let me begin by saying I'm writing this in a fit of Rage. I've been using Netflix through various different accounts for years, always through family members. I've seen countless movies and shows and they've been worth the $10-16 a month- up until this past year, the disappointment, disgust, anger, confusion- a company so large so vast- THE COMPANY TO SHUT DOWN BLOCKBUSTER? A shame a true shame I tell you now. I can say that the sadness I felt the first time I saw that “member of household” butt crap, was unmatched. I am revolted, I've dedicated so much of my life to the good deed of doing right unto others for that is what Jesus would do and this is the thanks I get? Selfishness from those who hold such power? This is abuse, this is an atrocious act against humanity, community, friendship and family across the globe. I can only imagine what kind of vileness and hatred went towards this cowardly and cheapskate act against the good of the people. I just hope that one day you can look back and tell yourself that in the end you did the right thing, the right thing for your countless and I mean COUNTLESS customers, we're more than customers we're families we're acquaintances, we're coworkers, we're exes. we are more than subscriptions, we're a community and your the ones holding us together, you built this site from the ground up with joy laughter and entertainment for all through many years, don't tear it down in one with greed. 

Sincerely, Sarah",Negative with Suggestion
"I love how seamlessly the AirTag connects to the iPhone. I put one on my keys, and it makes finding them so easy. When I first bought one as a gift, we even turned it into a fun game—one person would hide it, and the other would use the tracking to find it, like a mini scavenger hunt! Just add the AirTag to the Find My app, and it literally guides you to it, even showing how many feet away you are. Plus, you can play a sound when you're close to help locate it faster. Such a lifesaver!",Positive
Translate review to English,Negative with Suggestion
"Last year I bought a new Mac Mini. Of course, it's just a box and requires a mouse, keyboard and monitor. My wife had an old, dead iMac, so I borrowed her keyboard (took it, actually lol). I had a monitor. But what I didn't have was a mouse. So my wife dug up an old Jolly Comb she'd been using on something else. One of those that requires you to plug in a dongle. Since it's battery powered, it also goes to sleep when you haven't used it for x minutes. Meaning you lose the cursor.And you lose a USB port. I do some music production, and that means I need USB ports, as many as I can get. So I finally got this Apple mouse, which I'd used years before.Un-plug the dongle, pair the Apple mouse once with a USB cable, and voila! I have a very responsive mouse, the cursor is always there (unless I'm typing etc.) and freed up that valuable USB port.Free of wires, another free USB port - life is good! :)",Positive
"New update is horrible , why switch tapping back to premium , and play in order , people will be exhausted by it , they will not bry premium , instead they will delete the spotify app only and switch to other apps , bring back the old updates or it is very difficult to listen songs like this and even feels disturbing to daily listeners",Negative with Suggestion
"I have used this app over the years to increase my meditation skills.  Learning about mindfulness practices.  Many other skills in being in the world in a positive way are discussed and actual practices can be experienced.
Linda",Positive
"I have been using the Aveeno Baby Daily Moisture Bath Wash & Shampoo for my child for the past two years, and it has been amazing! The formula is gentle, tear-free, and hypoallergenic, making it perfect for sensitive skin. It cleans effectively without drying out the skin, leaving it soft, smooth, and well-hydrated after every bath.The light scent is pleasant and not overpowering, and I love that it's paraben-free and made with natural oat extract. It lathers well and rinses off easily, making bath time quick and hassle-free.Overall, this is a fantastic baby wash that I highly recommend to any parent looking for a safe and nourishing option for their little one!",Positive
I think I may have accidentally written a poor review on this item and that was meant for another product. This was great and everything was as expected. Thanks and sorry if I did accidentally leave a bad review not meant for you! :),Positive
"high quality build, great integration on all apple hardware, and great battery life. been using this brand / type of Apple mouse since it was available back in 2010. Ive since owned several for my marketing business. the bad: charging port on bottom of mouse, cant use and charge at the same time.",Positive with Suggestion
"The Apple AirTag is a lifesaver! Setup took seconds, and the Precision Finding feature makes locating my keys effortless. The battery lasts a year, and it's water-resistant, so no worries about spills. I only wish it had a built-in keyring hole, but that's a small downside. If you lose things often, this is a must-have!",Positive with Suggestion
"Super easy to use and I put it on my pet in case anything happens. Luckily haven't had to use it much but I've checked it a couple of times and works perfect. I also get a notification when I “leave” it, just in case it's a mistake.",Positive
"💩 app and your update is just 💩💩. Spotify is trash, junk yard. Such a sick retard app.",Negative
We booked flights from Edinburgh to Newark leaving on 16 May returning from Nashville to Edinburgh on 16 June as part of a special trip to celebrate our 50th wedding anniversary. The flight going out was delayed for hours! We were left sitting on the plane and they stopped people getting on the flight. They then started asking for passengers to give up their seats. They had obviously overbooked the flight and it was just chaos. Eventually we took off but were told as the plane was heavier than it should be it would take longer to get to Newark. As a nervous flier this was a bit worrying! Great start to our holiday! When we tried to check in for our return flight on 14 June we couldn't find our booking on their website albeit we had confirmation from when we booked several months earlier. It was impossible to get through on the telephone to speak with anyone so we had to get a taxi to the airport to try and sort this out. United do not have a customer service desk so the only way we could speak with someone was to stand in the check in queue for an hour. When we explained we had booked flights for the next day but were unable to find our booking the female assistant just took our paperwork and started looking on the computer. She didn't say one word to us! After twenty minutes she handed us a piece of paper which indicated we were back on the flight but with no booked seats (we had our seats booked originally). There was no reason given as to why this had happened and no apology. We had to get a taxi back to our accommodation and spent the next couple of hours trying to get our seats sorted out. This was the last day of our holiday and it was completely ruined by their inefficiency. It was such a stressful day and caused a lot of upset. I contacted United complaints on our return and eventually received an apology but no reason for what had happened or offer of compensation. When I asked again why we had been removed from this flight they completely ignored me. How do they manage to get away with this atrocious service?!? Could never recommend them and won't use them again.,Negative
Better understanding of the process to gain higher visibility of products awareness and competitive markets,Negative with Suggestion
"I like the mouse but the fact that it charges on bottom is obnoxious. You have to literally stop working. Kinda ruins this mouse for me because when you are focused and it goes dead with zero warning, it ruins your work focus.",Negative
"Flight from Edinburgh to Chicago cancelled on July 1st, flew out 28 hours later.  Numerous messages on the app, DMs on twitter, emails trying to get compensation.  The story from United changed constantly.  The latest is that I'll get ‘resolution' on approx December 14th.Disgraceful.",Negative
Latest update is very bad,Negative
I am amazed by the battery life of this air tag. It's a perfect way to get keep track of your kiddos when they leave for school. I guess I'm a helicopter mom. I clipped on of these bad boys onto my sons backpack. So I can keep tabs on his location lol.,Positive
They took the AirPlay feature off. This is so ridiculous as I travel for work and should be able to AirPlay since I can't log in everywhere I go already. I hate this streaming service and hope it crashes and goes bankrupt,Negative with Suggestion
I flew first class and was so thankful. 3 flights in a day snd 3 flights home. The service was exceptional and my flights were on time and drama free. Just the way I like it. United did an awesome job and that's the reason I try to fly with them as much as possible.,Positive
Really like this 40oz Stanley Cup. It keeps the water cold and ice does not melt for at a minimum 24 hours. Keeping it filled reminds me to keep drinking water to stay hydrated.,Positive
"Good for starters, but I wanted more updated content.  Adwords has changed a ton since this training was made available.",Positive with Suggestion
Delayed for two days now and still waiting. The worst flight experience I've ever had in my life and they refuse to compensate me back for the ticket. Terrible customer service. Worst customer service I've EVER had. It wins a lot of #1 worst awards for me. All around the most terrible company I've ever dealt with. Garbage airline and needs to be shut down,Negative with Suggestion
"The truth...I booked a premium economy seat, to the USA because it was cheaper than other airlines like BA, Virgin etc...the booking was made through Lufthansa airlines who partner up with United Airlines.Pro'sNone! Con'sThe whole plane looked like it was going to fall apart. Loose exit signs.Loose panels on seats. Broken food tray and TV screen arms. The seats and compartments were dirty.There were empty packaging and tissues in compartments. The food tray was the dirty. The toilets were dirty too. The food options on the phone app are impossible to access and impossible to change. The planes need a good deep clean or need a full refurbishment.The meals were tasteless and the tea was bitter. The fruit looked dried. The bread was rock hard.",Negative with Suggestion
This was a great course that has taught me more than enough to run my first Google adwords. That is what I hoped for from this course and it delivered.,Positive
"When I open calm it makes me feel welcome and safe. And every one 
Everywhere should be able to feel that so get calm it helps in so many ways for people like sleeping and calming also it help people who are alone and have know one to listen to so just thank you.",Positive
"Head & Shoulders is the worst product to consider putting on your head, so I stopped using it a long time ago. My family suggested I try this one, and it actually helped my hair grow a lot healthier in just a few weeks! It also smells pretty good too. 😚",Positive
My husband loves his new Stanley. The color is a dark Hunter green with a dark lid. Fits easily into most cup holders (almost all car cup holders). 10/10. Would recommend.,Positive
"BEWARE OF UNITED AIRLINES, AND AIR CANADAOn July 15, I hired Kathy Gill, Busy Time Travel, Avoya Network to become my agent regarding an upcoming trip to Churchill Manitoba. She arranged flights with United Airlines and Air Canada for November 1, 2022.  Twice my flight were cancelled. Neither time my flight was rescheduled, nor did the airlines notify me. On October 11, I called Air Canada to ask which gate I should arrive at. They told me that my flight had been cancelled on Sept. 12.  Had I not contacted Air Canada about departure information, I would not have known. I spent hours with both airlines in the next two days. I was charged another $163 from Air Canada. I had to purchase new flights to Winnipeg. United told me I was due a refund of $26, and refused to give it to me. I informed both United and Air Canada that only I be allowed to make any further changes. They agreed.On October 31, Gill emailed me. She stated my entire, original $805 United/Air Canada charge was disputed by me. It was not. Once again, I had to call the airlines to confirm that her allegations were incorrect. Once again, much more wasted time and stress.Again, on October 31, less than 13 hours before my departure, Gill cancelled my flights with United and Air Canada. The airlines never informed me. They allowed Gill to cancel the flights that I made on October 11, despite their assurances that Gill would noy be allowed to intervene. I spent hours again on the telephone hours before departure hoping that I would be allowed to depart.  This new flight resulted in a three hour earlier departure, with an extra stop in Chicago. On November 1, I had to spend more of my vacation time trying to arrange another flight home.On October 12, I sent a letter to the Scott Kirby, the CEO of United. A copy is enclosed. I also emailed a letter to Michael Rousseau, the CEO of Air Canada. Of course, neither responded.These airlines have caused me many, many hours of work, stress and extra expenses. This has been a pitiful experience for me. They have nearly sabotaged my entire $8000 trip to Churchill, Manitoba.I believe that I am eligible for compensation and refunds.",Negative
"This tag will fit inside a holder to attach to your pet's collar.  You need to buy the holder separately.  Using the iPhone's Find My app, you can track the whereabouts of your pet in case it escapes.  There are no monthly charges to make the tag function.",Positive
This course is a very good starting point for those wanting to learn about online advertising. It covers the important bases of AdWords in a succinct yet thorough manner. I'm trying my first campaign and I look forward to see my ROI.,Positive
Enjoyable with less hustle,Positive
"A lot of the basic pieces you need to create pretty much anything. A good supplement to all the specific sets that you buy. The set comes with some pretty great design ideas, as well. My 7 year olds were thrilled.",Positive
"Wish i could connect to multiple phones at the same time! But, works great for a set of keys.",Positive with Suggestion
"This is my second mac mouse. This one is smaller then the first one i had and really uncomfortable to hold.  I use the mouse all day and many times a day it won't track.  I tried everything, cleaning, turning bluetooth on and off.  Nothing works.  I am just going to get a 10$ mouse and hope it is better.",Negative
I've had 2 pairs for running and would use them for yard work after I wore them out for running. Now I just bought a pair for casual wearing.,Positive
"I have the 40oz already and it works great but sometimes I just want something smaller to tote around and the 20oz is perfect! Fits just enough water for quick trips around town or at home. Its small size makes it easier to carry into church, etc. Especially glad it has a handle. A small one, but it works!",Positive
"This is my second Stanley cup, and I got this one specifically for work—absolutely love it! It keeps my drinks cold all day, is super durable, and the handle makes it easy to carry around. The size is perfect for staying hydrated without constant refills. If you're on the fence, just get it—you won't regret it!",Positive
