feedback,Category
"We traveled from Copenhagen to Dallas in mid-December and our bags were lost; we eventually got our bags back 6 days later. But we had to purchase clothing, winter coats, toiletries, etc that amounted o over $1200 between the two of us. I submitted the claim in early January and was told we would receive the reimbursement within 30-60 business days. Nothing came until late May (1.5 months late) AND they made an error. We only received $180 because United didn't transfer the correct currency to my Danish account. I emailed United right away and was told the remaining balance would be transferred, give it 2-3 more weeks. Nothing came.July comes. I've called muliple United agents. Each time I spend 30+ minutes on the phone going back through everything, explaining how I was sent the wrong amount. My case was escalated by a manager in August; nothing happened. My case was excalated in September; nothing happened. I'm given the run-around, promised updates via email and phone calls, of course, no transfer happened.It's October 9, 10 months later, and once again I am on the phone with an agent (40 minutes this ime) arguing for the money owed and promised. The latest lie is that since an agent offered me a $300 United voucher for the incredibily long processing time, my case is closed because I ""settled"" for the voucher. Who in their right mind would settle for a voucher that's 1/4 the amount rightfully owed them? I don't plan to fly United ever again; give me a voucher, don't give me a voucher... I don't care. Your customer service is appauling and I deserve the money owed to me.We had to spend a lot of money on things we didn't plan for just before Christmas. Plus the stress of shopping for essentials, tracking our suitcases, wondering if the gifts we brought from Denmark would make it in time or at all. How can you treat your customers like this? You have the money and resources; you need to do better.",Negative with Suggestion
"I love the variety of options, and that you can mark those you particularly enjoy! My complaint, however, is you can't mark something that you didn't like it. It's nice that you can see your favorites all together but it would be nice to see which ones you do not want to try again",Positive with Suggestion
"Unfortunately the latest update renders a very unfriendly glitch that causes the selected movie or series to immediately stream without ever having pressed the play button. Especially problematic when trying to read the synopsis or scroll down to view see the trailer. Contacted Netflix and was informed that the glitch is intentional on all smart tv's as part of the experience. Brilliant! Congratulations Netflix, you've devolved into a mediocre app offering a crappy viewing experience for watching content that is becoming increasingly less than satisfactory. Way to attract and retain viewership!",Negative
"United's dysfunctional partnership with Vistara Airlines.We had booked Business Class Award Travel for flights SEA-SFO-DEL-BOM using 93,500 miles.United failed to transfer our bags to the Air India flight in SFO even though there was 2 hour connecting time. To make matters worse, they did not send our bags to DEL on the next day's flight. Instead they sent the bags 2 days later via Chicago to Delhi, resulting in a 4 day delay of some bags and 6 days on another.We have received sincere apologies from UA, but such mistakes should not happen. Someone in SFO baggage department needs to be fired and replaced with a competent person.",Negative with Suggestion
UA960 flight got delayed more than 4.5 hours at Newark on 17December 22 Making my freshman kid loose connecting flight in Frankfurt. Poor communication and facilities provided in case of delays. Never to fly United or American or Delta for international routes.,Negative
"I am taking this course to help me become a better candidate for new jobs, this course is easy to understand and follow along.",Positive
"While I'm very technical I did not have a chance to experience AdWords so far, and this course was a perfect introduction, with clear concepts and concise walk-throughs. Highly recommended!",Positive
"Absolute nightmare! The staff treats you horribly, they dont care about the customer, they mislead you with wrong information. We missed our connecting flights twice because both of their flights were delayed. I will never book a flight with them again!",Negative
"I have long been told that mindfulness would help my anxiety and ADHD (51 year old adult here), but every time I tried over the years it was so boring and simply maddening to just sit and try not to be distracted. Calm isn't like that at all! I do the walking meditations and the moving meditations, I listen as I lay in bed at night and I'm doing it often enough I can listen to the meditations while I do other activities such as drive and just focus on listening and breathing. It's a game changer and I'm learning to let go of my anxiety and panic. Thank you!",Positive
This was the best Stanley I have purchases. IT's taken a couple of tumbles and  has been very durable. Keeps my water cold all day long!,Positive
"My luggage got lost back in July 2022, was delivered to a wrong address in August 2022 and now (February 2023) they still haven't made any effort to solve the problem. Called the customer service dozens of times but all they say is they can't help me.",Negative
"I love my Stanley cup!It keeps everything cool and hot if that's what you look into.It's leak proof and very easy to clean.This cup is just the right size to fit into my car cup holder. ( which is awesome since most cups don't fit )Though a bit on the costly side, but I'm happy with my purchase.",Positive
"I love this app,me my sister and my mom use it and it gives of great device and motivational things this app changed the way I think I hope more people use this app because it is life changing and it helps me fall asleep get motivated and meditat on what I  am  thankful for.",Positive
"I bought this AirTag in August '24. It works well to track my car and I paired with Find My on my iPhone as per the instructions. The tracking is not super precise in motion; if you are tracking your item as it moves it can take a few minutes to sync. I've used it before to find my car in a big university parking lot, for example, so I don't have to worry about finding where I parked after a long day of classes. Also it gives me some peace of mind living in an apt complex with no gates where people have stolen cars before.",Positive with Suggestion
I'm just getting into Adwords and found this course very useful in getting my first campaign up and running. Corey is insightful and concise. Some material probably goes further than a normal 'beginners' course which is a huge plus. Thank you!,Positive
"These sets are amazing. Great for young and old, as you use your imagination to create cool designs and objects. Great set of Legos.",Positive
"The color is so much prettier than expected and it came on time. My only problem was that it came with a little scratch on the bottom and with the straw already in the cup, which i have never experienced before when ordering a stanley. The scratch is barely noticeable so i'm not too worried on that. Other than that, was worth it!",Positive
"It's very understandable, no complecations at all. Before I bought this coarse, I thought I wouldn't understand the material.",Positive
"You do know there's households who are co parenting and use different wifi's now we aren't able to use the service do to this change. Thank you Netflix for making it impossible for my kids to not enjoy their shows. What were you expecting when you guys made this move? Please make an option so my kids don't lose out. It's bad enough we are a split household, don't take this away from them. Your prices went up then this. This isn't workable. You would think you guys would be a little mindful when you did this. But in all honesty it will cost you in the end. In case you haven't already read the comments your subscribers wrote you. Please make this work. 
I wish I could give you a positive review. But this doesn't even deserve a star. Nice let down.",Negative with Suggestion
An airline that is always know for mistreatment of religious minorities and believes.,Negative
Very comfortable. Excellent price.,Positive
On April 22 after checking in for my flight I was trying to go through tsa and was told my id and name on boarding pass don't match. I was told to go back to united counter and have my pass changed. The manager told me I needed to call American express because I book through them. I was on the phone in the airport for two hours with American express who was on the phone the whole time with United. Neither could change my ticket. At this point I was frantic and went back to the counter and said I have to get home what can I do. The manager said I had to buy a whole new ticket by that time I had to purchase a later flight. Nothing worse then feeling like you are going to be stranded somewhere,Negative
I loved that the Apple mouse is easy to use and makes it easy for me to scroll,Positive
"I've been using the Apple Magic Mouse for a few months now, and I can confidently say it's one of the best mice I've ever had! First off, the design is incredibly sleek and minimalistic, which fits perfectly with my Mac setup. The wireless Bluetooth connection is seamless, and I've had zero issues with lag or disconnection.The multi-touch surface is a game-changer. I love how easy it is to navigate through pages and apps with gestures like swiping and scrolling. It makes using the mouse so much more intuitive and enjoyable, especially when multitasking between different apps and windows.The rechargeable battery is another huge plus. I've only had to charge it a few times, and it lasts for a surprisingly long time. It's so much more convenient than dealing with disposable batteries.Overall, the Magic Mouse is smooth, responsive, and looks great on my desk. If you're in the Apple ecosystem and looking for a mouse that works effortlessly with your Mac or iPad, this is definitely the way to go. Highly recommend!",Positive
"Habe noch nie im Leben so einen schlechten Kundenservice erleben dürfen, das die sich überhaupt Service nennen dürfen! Wer wartet freiwillig 8 Wochen auf eine Antwort? Erst über 3 Stunden an meinem Endziel angekommen und nun bekomme ich keine Infos wie es weiter geht, bereits mehrere Mail geschrieben ohne Antwort.",Negative
Cory really knows his adwords and is excellent at passing it on to his students.   Very thorough course and one that every marketer and anyone trying to advertise and sell on the internet should take,Positive
Translate review to English,Negative with Suggestion
I love this mug. I use it everyday for ice water. At the end of the day it still has ice even after being refilled with water several times.,Positive
Corey's course is vey well organized and presented. Udemy is becoming very saturated with content of people not actually succeeding in what they teach. You can clearly tell Corey has great experience in this field. Don't be on the fence about taking this course. Get it and you'll be glad you did. Thank you for the valuable content Corey.,Positive
Like this product,Positive
excellent Apple product.  Works exactly as advertised.  No need to have GPS because this does the job as long as you have apple infrastructure.,Positive
Good Product All Around,Positive
Rapper Trapper Public Figure Director,Negative
"I purchased these Legos for my 5 year old grandson's birthday and he loves them and has already constructed a house all by himself!  My sons, aged 55 and 57 years old, loved playing with Legos when they were young!",Positive
These are very comfortable and look awesome!,Positive
This WAS the best music app now even listening to a song of our time stamp requires premium so annoying 😔😔😔 didn't expected this from Spotify very disappointing I hope one day their development team watches this review and give us our Spotify back 🙂,Negative with Suggestion
"If you'restarting out with AdWords, this course is exactly what you need. Thanks Corey - Can't wait for your ""Advanced AdWords Course""",Positive
I had no clue about Google Adwords or how to set it up and this course has been so helpful! He's literally walking me through the steps to get my small businesses google AdWords set up. Very clear and concise!,Positive
The course was very useful and helpful as an intro in google ads. Sometimes  gives very useful links and sources about different types of  strategies.,Positive
"I bought this cup since I trust STANLEY. It is well made from recycled 18/8 Stainless Steel. It is supposed to be spill-proof, and it is with the straw in if it falls over to the right, less if to the left.  It leaks worse when “closed” .  I have told STANLEY about this and how to fix it  and just maybe will fix this. I hope so!  Even with the straw in, my hot tea was hot for several hours  I really love it!",Positive with Suggestion
"I enjoyed the course, I'm an absolute beginner, so I still have lots of questions, but I have a much better understanding of what needs to be done. I think when the course gets updated according to all the changes in the interface etc - it would be much easier to follow instructions. Overall - great structure, professional manner. Thumbs up!",Positive with Suggestion
"I will never fly united again. The lie, leave you strandad, and cause you to spend $$$$ at other airlines to fix their mistakes. All with never reimbursing anything they promised they would.",Negative
This was the best music app ever but now it's become worst need premium for all the features I had been using since last 4 years but now I am going to uninstall,Negative
"I decided to purchase a Stanley cup and I have made the best choice. They have so many colors, different styles and sizes to choose from.What stands out the MOST is its impressive insulation. It keeps my water ice cold for hours which it can last a day. The handle is sturdy and is a great addition to the cup. The handle makes it easy and super convenient to carry around. I've had zero issues with leaks. I've purchased the little leak proof accessories to aid in cases I accidentally tip it over.The large capacity is a game-changer; I no longer need constant refills. If you're looking for a durable, high-quality tumbler and one that's looks stylish this is the one. I highly recommend this brand. You won't regret your purchase.",Positive
"Has all the fun pieces, my kids love building with these!",Positive
Worst app everthing is available only on premium only new updates sucks deleting this app... Ridiculous service,Negative
"Softness,smell so good,value for money 💯",Positive
United sucks and so do the people working for them… I will never fly with United again! Horrible horrible horrible airline!,Negative
"Shocking experience with United Airlines, who left our family including 2 elderly people and an infant stranded in Boston over the Boston Marathon weekend for 2 days. We incurred over $1,000 in extra hotel and food costs, and United refused to compensate us even one cent in violation of Canada's Air Passenger Protection Regulations!On the morning of our scheduled departure, United told us the Boston-Newark leg of our journey (United 523) was delayed because of an earlier delay impacting our plane's arrival, meaning we would not have sufficient time to make our Newark-Calgary connection. United further confirmed that the reason for the earlier delay was boarding of the aircraft taking longer than expected, which is within the airline's control. Due to the delay, United asked us to either re-book on a different United flight or get a refund.We spent over 2.5 hours on the phone with United trying to find an alternative flight, but were told that the earliest available alternative was not for another 2 days, even though we showed great flexibility e.g. we were willing to connect via a different city, split our family up so we flew on different airplanes, and / or accept a longer connection time. Despite this, United said there was absolutely no option for us to fly for another 2 days.We looked ourselves into flying with another airline, but the cost of such last-minute tickets was thousands of dollars per passenger and therefore prohibitively expensive. This meant cancelling our United flights and getting a refund was not a feasible solution. We note that United did NOT offer us the option of arranging a flight with a different airline carrier without additional expense, which is contrary to our rights under Canada's Air Passenger Protection Regulations (APPR). We therefore accepted the new United itinerary.We were shocked that a leading international airline like United was not able to reschedule us for two full days. Our family includes two elderly people and a 4 month old infant travelling long distance for the first time in his young life. My wife has debilitating back and gastrointestinal issues and was forced to suffer a further two nights in a foreign country and hotel, rather than having the comforts of her own home and medical care. Our destination city of Calgary is not a small town - it has a population of 1.45 million people and a very active international airport. We were stuck in Boston during the very busy Boston Marathon weekend, which forced us to stay at an expensive hotel 2 more nights than we planned as we could not find last minute accommodation elsewhere (as you can imagine, it is even more difficult to find a hotel room that works for an infant and an elderly person with back problems). We also incurred additional meal costs and transportation costs to the airport.Our total additional expenses amounted to USD 1,110.We filed a formal complaint with United and requested compensation for this under the APPR legislation. It took United close to 2 months to reply, and they refused to provide any compensation whatsoever (vaguely blaming the weather, which was the first time we heard this excuse!), which is in violation of the APPR. We are now filing a formal legal complaint with the Canadian Transportation Agency but also wanted to write a review to make the public aware. All airlines have their issues, but this is a new low given our vulnerability",Negative
"Got this cup for my husband for Father's Day. He travels a lot and I wanted him to have a cup to take along with him that would keep his drinks at the temp he wants. No complaints other than how it was delivered. It didn't come in the Stanley box/packaging. Just in a paper bag and no bubble wrap. It was scratched up a bit, but luckily my husband isn't picky and didn't mind it enough to send it back. Overall great product other than it not being leak proof. Don't tip it over while full. It will spill.",Positive with Suggestion
"A lot of the information is outdated, as in hasn't been updated since 2013. I am now learning this in 2022. Also, you do need a fundamental understanding of all of the metrics, otherwise you will struggle.",Negative with Suggestion
my son has been using this for 10 years. no problem at all great for kids. even youth.,Positive
"I recently upgraded to the Apple Magic Mouse, and I couldn't be happier with my purchase! This wireless, Bluetooth, rechargeable mouse has truly enhanced my Mac and iPad experience in several ways.**Easy Setup:**Setting up the Magic Mouse was a breeze. It connected instantly via Bluetooth with my Mac, and the pairing process was straightforward. The rechargeable battery is a game-changer—no more fumbling with disposable batteries. A quick charge using the Lightning cable and it's ready to go, providing long-lasting power that keeps up with my busy schedule.**Multiple Functions:**The Magic Mouse is not just a sleek accessory; it's packed with functionality. The multi-touch surface allows for intuitive gestures such as swiping between pages, scrolling effortlessly, and accessing Mission Control with simple finger movements. These gestures make navigating through applications and documents so much smoother and more efficient.**Design and Comfort:**The minimalist design is both elegant and ergonomic. It fits comfortably in my hand, reducing strain during long work sessions. The smooth, responsive surface ensures precise cursor control, which is essential for tasks ranging from graphic design to everyday browsing.**Compatibility:**It works flawlessly with both my Mac and iPad, seamlessly switching between devices without any hiccups. Whether I'm working on a project, browsing the web, or managing emails, the Magic Mouse adapts perfectly to my needs.**Additional Features:**The rechargeable feature is incredibly convenient, eliminating the need for constant battery replacements. The low-profile design complements my Apple setup beautifully, adding a touch of sophistication to my workspace.Overall, the **Apple Magic Mouse** is a fantastic investment for anyone in the Apple ecosystem. Its easy setup, versatile functions, and sleek design make it an indispensable tool for enhancing productivity and user experience. Highly recommend it to anyone looking for a reliable and stylish mouse!",Positive
Easy to follow high level overview of AdWords. He hits the main concepts without getting lost in the details.,Positive
Thank you so much for this Course and all the details. It is very clear and I am now able to create my own campaigns!,Positive
"I really want to love it because I LOVE some of the touchpad-like functionality. But as many others have said, the ergonomics are really poor. I've considered getting some of the ergonomic accessories/add-ons, but it's also a little heavy, and takes a bit more effort to engage a click than feels healthy. Wish it had tap to click! (I actually tried a third-party app to help with that – but while it added the functionality, it was a bit buggy/jumpy, so I didn't keep using it.)Alas, this little guy is getting returned… Keeping it at 3 stars rather than 2 because for someone who is only a light computer user, it might be okay. But I have to use it for my remote computer job, for both design and admin.",Negative with Suggestion
"Our 4 bags arrived a day late to Ohare, 2 days later we received at our home 2 bags, the other 2 are located in terminal 1 of Ohare according to our Apple bag tag.  Everyday I called and everyday we got the same answer, ""they will be on the next truck loading at 11 am.  Yesterday I was told to go to Ohare to baggage and pick up.  We went today, and my bag tracker says the bags were 400 feet away, we took pics but alas were told to just file a claim.  Rude people reading scripts, just telling us what we want to hear",Negative
"Very pleased even though I ordered and paid for 30oz they sent a 40oz. They're loss my gain, but I love it. Holds ice for almost 2 days! Love the color and quality. And I also bought some dressing for it! Cute little straw cover and skirt!",Positive
"I used to make fun of people for using these Stanley cups, I always thought they were overpriced and over hyped. But I purchased this for my little sister who is in nursing school, and she takes this thing with her everywhere!!! All she does is rave about how amazing it is! So I bought one as well, and they really are amazing products. Made super well, they keep ice in them for hours and hours! Super comfortable to hold in your hand, not too heavy or bulky. Easy to clean and seem to be super durable. I've dropped mine I don't even know how many times now, and not a single mark! They also don't leak easy at all. Unless you're holding it completely upside down, even then it doesn't leak fast. Super happy!",Positive
"Son loved them, true to size",Positive
I got this for my key ring as I'm always losing my keys. The location is accurate which makes the keys easy to find.,Positive
"I used to own a pair a few years ago and they are hard to find. I enjoy how comfortable they are when running and working out. Good traction when powerlifting. Light weight for running, breathable so no smelly feet lol. I got them in black but I believe they come in white too. Durable as heck, I will hike in these. Give em a try.",Positive
do you like music blasted in the plane for a 10 pm flight? do you like your flight to be delayed because the catering company was late getting first class their food? fly with united for a headache before you leave the ground and an extra hour sitting in the plane.,Negative
I love the color it so pretty . And the ice temperature I woke up and my ice is still cold I love it . Thank you so much Stanley and I don't drink enough water so this definitely will motivate me to do so 🥰🥰,Positive
"I have used United for a long time an have had good experiences with them except for time before last an the clerk at the check in was rude. But the last trip I made  I flew out of New Orleans an the worker at the ticket counter was very nice. She took my phone an used the Kiosk an checked me in, an was very helpful. Her name was Andree Roberts An I want to shout  out what a very good employee United has . Wish everyone was this nice !!!",Positive with Suggestion
